{
  "$schema": "https://json-schema.org/draft/2020-12/schema",
  "$id": "https://dsh-plugins.local/agent-tui/markdown-provenance.schema.json",
  "title": "Markdown corpus provenance",
  "type": "object",
  "additionalProperties": false,
  "required": ["schema_version", "source", "files", "status", "bundleHash"],
  "properties": {
    "schema_version": {"const": 1},
    "source": {
      "type": "object",
      "additionalProperties": false,
      "required": ["repository", "commit"],
      "properties": {
        "repository": {"type": "string", "minLength": 1},
        "commit": {"const": "47f943859bef60e4160492346772ded9b24f765a"}
      }
    },
    "bundleHash": {"type": "string", "pattern": "^[0-9a-f]{64}$"},
    "files": {
      "type": "array",
      "minItems": 46,
      "items": {
        "type": "object",
        "additionalProperties": false,
        "required": ["path", "sha256"],
        "properties": {
          "path": {"type": "string", "minLength": 1},
          "sha256": {"type": "string", "pattern": "^[0-9a-f]{64}$"}
        }
      }
    },
    "status": {
      "enum": ["pending_source_import", "admitted"]
    }
  }
}
